fecha_publicacion,candidato,titulo_video,vistas,likes,comentarios,suscriptores_canal,engagement_rate,engagement_por_1000
2025-07-29,Vicky Dávila,La estafa del Acuerdo de La Habana | #vickydavila,3213,343,17,334000,10.68,1.08
2025-07-24,Vicky Dávila,Erradicaremos  el consumo en los parques,2105,240,9,334000,11.4,0.75
2025-07-24,Vicky Dávila,Nuestra seguridad nacional está es riesgo,4186,301,21,334000,7.19,0.96
2025-07-23,Vicky Dávila,Hay PETROTIBIOS ENMASCARADOS en la contienda electoral | Entrevista @Revista_Semana,1108,70,22,334000,6.32,0.28
2025-07-23,Vicky Dávila,Así será nuestro GOBIERNO 4X4 para RESCATAR A COLOMBIA,1570,66,52,334000,4.2,0.35
2025-07-22,Vicky Dávila,Necesitamos un Plan Colombia 2.0: cooperación internacional para recuperar la seguridad del país,1840,161,25,334000,8.75,0.56
2025-07-21,Vicky Dávila,Lo único que les pido a los colombianos es que recen por mí y por Colombia,2549,207,31,334000,8.12,0.71
2025-07-20,Vicky Dávila,Colombia necesita un gobierno justo y con valores | Vicky Dávila con @Yovelenlinea,1419,108,85,334000,7.61,0.58
2025-07-20,Vicky Dávila,Petro es una amenaza para Colombia | Entrevista con @PatriciaJaniotvideos,1735,153,67,334000,8.82,0.66
2025-07-19,Vicky Dávila,Pilar 1: Los corruptos deben pagar | Visión de país - Vicky Dávila,2065,140,18,334000,6.78,0.47
2025-07-19,Vicky Dávila,Vamos a hacer lo que toca para liberar al Cauca,602,63,24,334000,10.47,0.26
2025-07-19,Vicky Dávila,El Cauca está secuestrado por criminales con respaldo del Gobierno,1424,66,7,334000,4.63,0.22
2025-07-19,Vicky Dávila,Es urgente tener un Cauca libre de grupos criminales,189,18,4,334000,9.52,0.07
2025-07-19,Vicky Dávila,Me comprometo a capturar y extraditar a Mordisco,1539,121,11,334000,7.86,0.4
2025-07-18,Vicky Dávila,"Mordisco, usted es un cobarde",1534,108,14,334000,7.04,0.37
2025-07-18,Vicky Dávila,Este Gobierno está desesperado por liberar a todos los narcos criminales presos,1387,68,11,334000,4.9,0.24
2025-07-18,Vicky Dávila,Está es la mejor parte de ser aspirante presidencial….,1432,131,8,334000,9.15,0.42
2025-07-17,Vicky Dávila,Colombia está llena de VALIENTES que sueñan y luchan por un país mejor,1741,121,6,334000,6.95,0.38
2025-07-16,Vicky Dávila,"Mi mayor sueño para Colombia, que las mamás puedan dormir tranquilas",1271,23,5,334000,1.81,0.08
2025-07-16,Vicky Dávila,"Petro está mal, muy mal… una tragedia para Colombia, un peligro.",6635,729,120,334000,10.99,2.54
2025-07-16,Vicky Dávila,"Petro Desatado: Racismo, Antisemitismo y Ataques al Gobierno | ¡Grave Crisis de Estado!",1919,113,10,334000,5.89,0.37
2025-07-16,Vicky Dávila,Viajes MILLONARIOS de Petro y Francia: ¿Dónde están los BENEFICIOS para Colombia?,501,43,39,334000,8.58,0.25
2025-07-15,Vicky Dávila,"¡No se trata de Miguel Uribe, se trata de RESCATAR  | Colectivo Radio de Cartagena",192,9,4,334000,4.69,0.04
2025-07-15,Vicky Dávila,El 31 de mayo daremos un GOLPE DEMOCRÁTICO para rescatar a Colombia / Voz del Pueblo Ibagué,333,34,5,334000,10.21,0.12
2025-07-15,Vicky Dávila,Las bodegas son sicarios morales que atacan con mentiras,1264,130,26,334000,10.28,0.47
2025-07-15,Vicky Dávila,Preguntas rápidas sobre personajes de la política colombiana.,1867,45,0,334000,2.41,0.13
2025-07-15,Vicky Dávila,Las bases de Petro se alimentan de odio y mentiras,1307,77,7,334000,5.89,0.25
2025-07-14,Vicky Dávila,Ser colombiano es sinónimo de valentía.,1571,54,4,334000,3.44,0.17
2025-07-13,Vicky Dávila,¡Los colombianos temen quedarse sin pasaportes!,1149,62,3,334000,5.4,0.19
2025-07-13,Vicky Dávila,La debacle de Colombia inició con Juan Manuel Santos,1601,111,22,334000,6.93,0.4
2025-07-12,Vicky Dávila,¡Petro no confía en el sistema que lo eligió!,1817,156,35,334000,8.59,0.57
2025-07-11,Vicky Dávila,Para la comunidad internacional: Ayúdennos a que este Gobierno no se perpetúe en el poder.,1279,119,7,334000,9.3,0.38
2025-07-11,Vicky Dávila,¡Colombia no será una dictadura! La vamos a defender | Vicky Dávila en TV Azteca,1289,83,52,334000,6.44,0.4
2025-07-10,Vicky Dávila,Estas palabras que me llegan al corazón.,1172,53,11,334000,4.52,0.19
2025-07-10,Vicky Dávila,Lo único que realmente nos salva de la pobreza son las oportunidades,1392,87,8,334000,6.25,0.28
2025-07-10,Vicky Dávila,"Cada firma es esperanza, es fuerza y es el primer paso para devolverle a Colombia el sentido común",333,26,7,334000,7.81,0.1
2025-07-10,Vicky Dávila,Gustavo Petro no es el único responsable de la crisis que vivimos,2250,190,20,334000,8.44,0.63
2025-07-09,Vicky Dávila,"Por ellos y por nuestros niños de Colombia, seguiremos siendo #VALIENTES. ✌🏻",484,33,3,334000,6.82,0.11
2025-07-09,Vicky Dávila,En Colombia necesitamos quitar los aranceles a los celulares y el IVA a los planes de datos 📱📶,2172,218,21,334000,10.04,0.72
2025-07-08,Vicky Dávila,Es imposible estar en Medellín y no escuchar una buena trova 🎶💛,1242,98,2,334000,7.89,0.3
2025-07-08,Vicky Dávila,"Junto a los barranquilleros, con determinación y firmeza vamos a sacar a Colombia 🇨🇴 adelante",1344,69,1,334000,5.13,0.21
2025-07-07,Vicky Dávila,"Siempre he valorado el trabajo de los periodistas 🎙️, independientemente si piensan igual a mí o no",794,53,5,334000,6.68,0.17
2025-07-07,Vicky Dávila,"“Necesitamos que Colombia tenga una buena directora, que trabaje por los colombianos”",717,63,27,334000,8.79,0.27
2025-07-06,Vicky Dávila,Juntos vamos a sacar adelante a Colombia🇨🇴. El apoyo de los ciudadanos me motiva a seguir. 🫂,1397,104,13,334000,7.44,0.35
2025-07-01,Vicky Dávila,"“Me quieren SACAR DE LA CANDIDATURA PRESIDENCIAL, viva, desprestigiada, judicializada o muerta”",1363,53,60,334000,3.89,0.34
2025-07-01,Vicky Dávila,"“VAMOS A LLEGAR A LA VERDAD. No crean en conspiraciones, en mentiras, en imputados.”",1235,52,33,334000,4.21,0.25
2025-07-01,Vicky Dávila,Charla con el excanciller Álvaro Leyva tras las grabaciones publicadas por El País de España,993,63,41,334000,6.34,0.31
2025-06-28,Vicky Dávila,"En Colombia ser, ser VALIENTES está en nuestro ADN. ✌️🇨🇴",1519,117,20,334000,7.7,0.41
2025-06-27,Vicky Dávila,“Vamos a CUIDAR LA PLATA de la salud de los colombianos”,562,53,46,334000,9.43,0.3
2025-06-26,Vicky Dávila,“La sociedad requiere que sus líderes sean transparentes y YO SOY TRANSPARENTE”,309,18,13,334000,5.83,0.09
2025-06-26,Vicky Dávila,“Hay que lograr que los menores tengan acceso a una buena alimentación en La Guajira”,523,42,11,334000,8.03,0.16
2025-06-26,Vicky Dávila,“Nuestro gobierno será lleno de MUJERES BERRACAS”,606,27,10,334000,4.46,0.11
2025-06-25,Vicky Dávila,"“Mientras no haya justicia y no se recupere la fuerza legítima del estado, Colombia es inviable”",729,61,15,334000,8.37,0.23
2025-06-25,Vicky Dávila,“Este movimiento ciudadano lo único que busca es RESCATAR A COLOMBIA”,804,51,45,334000,6.34,0.29
2025-06-25,Vicky Dávila,"“GRANDES CRIMINALES pasaron de la cárcel a la tarima, junto al jefe de Estado”",791,63,11,334000,7.96,0.22
2025-06-25,Vicky Dávila,"“Yo quiero ser presidente de Colombia, YO VOY A SER PRESIDENTE DE COLOMBIA”",418,18,27,334000,4.31,0.13
2025-06-24,Vicky Dávila,“El nombramiento de Saade es la DEGRADACIÓN DE LA MORAL PÚBLICA”,575,24,11,334000,4.17,0.1
2025-06-24,Vicky Dávila,“A este gobierno le encanta gobernar INFLUYENDO TERROR”,397,19,17,334000,4.79,0.11
2025-06-24,Vicky Dávila,“En Colombia estamos bajo AMENAZA CRIMINAL”,635,25,12,334000,3.94,0.11
2025-06-19,Vicky Dávila,"“Cada persona que me entregue su firma, está dando un mandado para SALVAR EL PAÍS”",1780,95,63,334000,5.34,0.47
2025-06-19,Vicky Dávila,“Vamos a caminar juntos para RECUPERAR A COLOMBIA”,470,38,16,334000,8.09,0.16
2025-06-19,Vicky Dávila,“Yo he sido trabajadora toda la vida. NUNCA ESTARÉ EN CONTRA de los derechos para los trabajadores”,455,37,10,334000,8.13,0.14
2025-06-18,Vicky Dávila,"“Si hay alguien VALIENTE, SON LAS MUJERES. Las mujeres van a hacer lo que toca para salvar el país”",803,61,13,334000,7.6,0.22
2025-06-18,Vicky Dávila,"“Que hayan NEGADO LA CONSULTA 2.0, hace que no pongamos un billón de pesos para hacer política”",641,51,18,334000,7.96,0.21
2025-06-18,Vicky Dávila,"Tras el ataque a Miguel, las campañas se detuvieron, pero debemos ser Valientes",14145,502,25,334000,3.55,1.58
2025-06-17,Vicky Dávila,El futuro solo pertenece a los valientes.,5058,593,46,334000,11.72,1.91
2025-06-15,Vicky Dávila,"Hoy marcho por Miguel Uribe, por Colombia, por la verdadera paz",5832,531,48,334000,9.1,1.73
2025-06-12,Vicky Dávila,"Colombia, no debemos tener miedo, esta es la última oportunidad que tenemos de salvar el país",9034,863,52,334000,9.55,2.74
2025-06-11,Vicky Dávila,Entrevista en El Debate de SEMANA sobre la marcha del silencio.,1919,111,25,334000,5.78,0.41
2025-06-11,Vicky Dávila,Este domingo todos a la calle sin importar el partido o la ideología.,4444,240,21,334000,5.4,0.78
2025-06-11,Vicky Dávila,Atención Colombia. El domingo vamos todos a las calles a la marcha del silencio…,4808,397,61,334000,8.26,1.37
2025-06-10,Vicky Dávila,Mi entrevista con Fernando del Rincón en CNN,1542,106,22,334000,6.87,0.38
2025-06-09,Vicky Dávila,Le dije al minDefensa que nos tienen que proteger y esto me respondió,31000,861,83,334000,2.78,2.83
2025-06-09,Vicky Dávila,Mi entrevista con Néstor Morales en Blu,1516,97,38,334000,6.4,0.4
2025-06-09,Vicky Dávila,Han pasado 48 horas del atentado. Yo no he recibido ninguna llamada de la UNP o de las autoridades.,4363,320,12,334000,7.33,0.99
2025-05-29,Vicky Dávila,Mi entrevista con Betr Media,1996,152,43,334000,7.62,0.58
2025-05-24,Vicky Dávila,Quiero darle las gracias a Esperanza y a la comunidad de Puente Aranda,3104,381,27,334000,12.27,1.22
2025-05-23,Vicky Dávila,"Las alertas de lo que puede pasar en Colombia, no son una fantasía",1804,246,12,334000,13.64,0.77
2025-05-23,Vicky Dávila,Debemos luchar contra la corrupción y una opción puede ser la de crear un bloque de búsqueda,3121,453,36,334000,14.51,1.46
2025-05-23,Vicky Dávila,Mi charla con Felipe Vélez en La Tertulia Política,1293,75,37,334000,5.8,0.34
2025-05-23,Vicky Dávila,"Debemos pensar en el primer empleo para los jóvenes, ellos merecen tener una oportunidad.",2094,320,20,334000,15.28,1.02
2025-05-22,Vicky Dávila,Mi entrevista con CW Más Noticias,4538,489,20,334000,10.78,1.52
2025-05-22,Vicky Dávila,"Petro, desde Cali le digo: la gente se cansó de sus discursos vacíos porque usted los abandono",4596,555,92,334000,12.08,1.94
2025-05-21,Vicky Dávila,"En un proyecto ciudadano, gobernar es servir a todos.  #colombia #vickydavila",1658,258,12,334000,15.56,0.81
2025-05-21,Vicky Dávila,"Las redes sociales son una herramienta que hay que usar, porque las comunicaciones cambiaron",1977,240,9,334000,12.14,0.75
2025-05-21,Vicky Dávila,"Este no puede seguir siendo un discurso vacío, es el momento de actuar.  #colombia #vickydavila",1480,207,10,334000,13.99,0.65
2025-05-20,Vicky Dávila,Liberen ya a Lyan. Los criminales se lo llevaron secuestrado hace dos semanas de Potrerito,3326,488,22,334000,14.67,1.53
2025-05-20,Vicky Dávila,"El Gobierno jugando con consultas populistas, usando el sufrimiento de los trabajadores",2882,378,7,334000,13.12,1.15
2025-05-19,Vicky Dávila,VAMOS A RESCATAR A COLOMBIA.  #vickydavila #colombia #juntossomosmillones,1950,339,17,334000,17.38,1.07
2025-05-19,Vicky Dávila,"Hoy les doy mi palabra, todo aquel que haya cometido fechorías, va a pagar.  #colombia #vickydavila",6976,972,46,334000,13.93,3.05
2025-05-19,Vicky Dávila,"Hoy en Barranquilla conocí a Fredy Cordero, un ciudadano de a pie que vive un viacrucis #vickydavila",3903,431,17,334000,11.04,1.34
2025-05-19,Vicky Dávila,"Hoy hablé con Yesenia, una mujer cuya fuerza y esperanza me conmovieron  #colombia #vickydavila",1894,267,15,334000,14.1,0.84
2025-05-16,Vicky Dávila,"Hoy en su día, toda mi gratitud, respeto y cariño para los maestros de Colombia. #vickydavila",6007,0,37,334000,0.0,0.11
2025-05-15,Vicky Dávila,Yo confío en nuestras Fuerzas Armadas. Están en el corazón de los colombianos #colombia #vickydavila,7274,936,37,334000,12.87,2.91
2025-05-15,Vicky Dávila,"Debemos luchar por la democracia, la libertad, por las instituciones y por el orden",4355,432,9,334000,9.92,1.32
2025-05-14,Vicky Dávila,"Los procesos de  la “paz total” deben tener un límite claro, el 7 de agosto del 2026",5313,626,20,334000,11.78,1.93
2025-05-13,Vicky Dávila,"A Colombia le urge un cambio de dirección, pero con los pies en la tierra",3233,402,25,334000,12.43,1.28
2025-05-13,Vicky Dávila,Gracias por abrirme las puertas de sus negocios y expresarme todo su sentir,341,22,13,334000,6.45,0.1
2025-05-12,Vicky Dávila,"&quot;Petro, de todo lo que prometió, no ha hecho ni m!3rd4&quot; me dijo un comerciante",10058,581,25,334000,5.78,1.81
2025-05-11,Vicky Dávila,"Ella es mi mamá. El amor puro, las manos más tiernas",2453,88,13,334000,3.59,0.3
2025-05-11,Vicky Dávila,OPORTUNIDAD,3583,462,28,334000,12.89,1.47
2025-05-10,Vicky Dávila,"No se trata de pelear por pensar distinto, se trata de ver la realidad con honestidad",2680,328,12,334000,12.24,1.02
2025-05-10,Vicky Dávila,"Mi miedo más es fallarle al país, mirar atrás y saber que no he hecho lo correcto",5347,725,27,334000,13.56,2.25
2025-05-08,Vicky Dávila,"Estuve en Floridablanca, Santander, un municipio conocido por sus Obleas.",7058,649,47,334000,9.2,2.08
2025-05-07,Vicky Dávila,"Me invitaron a “Colombia Tierra de Jóvenes”, un espacio de la Universidad del Rosario",2993,430,22,334000,14.37,1.35
2025-05-07,Vicky Dávila,Proyectos como Campuslands deben multiplicarse por toda Colombia #VickyDavila #Colombia,1696,120,13,334000,7.08,0.4
2025-05-07,Vicky Dávila,La Fuerza Pública se recupera desde la moral,10130,0,59,334000,0.0,0.18
2025-05-06,Vicky Dávila,"Míreme a los ojos, yo soy firme y no me tuerzo por nada del mundo. Cuente conmigo",2649,312,22,334000,11.78,1.0
2025-05-06,Vicky Dávila,En Campus Lands el 80% de los estudiantes son jóvenes que recién han salido del colegio,3314,495,19,334000,14.94,1.54
2025-05-06,Vicky Dávila,"Si queremos cambiar a Colombia, tenemos que salir, mirar a los ojos y hablar con la gente",4617,470,34,334000,10.18,1.51
2025-05-05,Vicky Dávila,Al mundo entero tiene que quedarle claro que los colombianos no vamos a rendirnos,3815,524,32,334000,13.74,1.66
2025-05-05,Vicky Dávila,"Los lazos de mi familia son mi tesoro más grande, mi refugio, mi fuerza.  #colombia #vickydavila",4646,496,16,334000,10.68,1.53
2025-05-03,Vicky Dávila,Esta y otras historias de mi vida las pueden encontrar en mi libro. #vickydavila #colombia,24588,1206,47,334000,4.9,3.75
2025-05-02,Vicky Dávila,Santa Marta merece respeto y resultados. 500 años de historia no se borran ni se roban.,4288,476,15,334000,11.1,1.47
2025-05-02,Vicky Dávila,"Pusimos a prueba a los seguidores de Petro, que hoy manifestaron su apoyo a la consulta populista",11894,659,147,334000,5.54,2.41
2025-05-01,Vicky Dávila,"Petro está ejecutando la TOMA DE Colombia, así como lo hizo el M-19 con el Palacio de Justicia",4375,0,69,334000,0.0,0.21
2025-05-01,Vicky Dávila,"Los colombianos están huyendo, no por gusto, sino por falta de oportunidades #vickydavila  #colombia",6800,702,34,334000,10.32,2.2
2025-05-01,Vicky Dávila,"Esta historia y otras, las pueden encontrar en mi libro “Mi historia y el costo de decir la verdad”.",6831,722,23,334000,10.57,2.23
2025-04-30,Vicky Dávila,Hoy más que nunca cuentan con nuestro respaldo. Los necesitamos fuertes. Volveremos a brillar,16799,1331,156,334000,7.92,4.45
2025-04-30,Vicky Dávila,"Te espero este 4 de mayo en el lanzamiento de mi libro, Mi Historia, el costo de decir la verdad.",39747,2546,39,334000,6.41,7.74
2025-04-29,Vicky Dávila,"&quot;Las mujeres sabemos lo que hace falta, no solo en la cocina, también en el país&quot;.",3464,270,10,334000,7.79,0.84
2025-04-29,Vicky Dávila,La gente está cansada de Gustavo Petro. Por eso apagan el tv cada vez que sale a decir mentiras,7327,394,28,334000,5.38,1.26
2025-04-29,Vicky Dávila,Pescadores de Santa Marta preocupados porque el Estado los tiene abandonados,2031,225,9,334000,11.08,0.7
2025-04-29,Vicky Dávila,La llamada “reforma populista” no es para los trabajadores,606,59,10,334000,9.74,0.21
2025-04-29,Vicky Dávila,Estoy en Santa Marta y mi primera parada fue para escuchar a los pescadores,21262,1182,128,334000,5.56,3.92
2025-04-29,Vicky Dávila,"Visitamos San Victorino, el corazón comercial del centro de Bogotá.",782,76,19,334000,9.72,0.28
2025-04-29,Vicky Dávila,"Un diagnóstico nos cambió la vida para siempre a Juan Carlos, a mi hijo Simón y a mí.",283298,6525,84,334000,2.3,19.79
2025-04-28,Vicky Dávila,"Gustavo Petro se comprometió con los jóvenes, y como cosa rara, no cumplió",10888,522,26,334000,4.79,1.64
2025-04-28,Vicky Dávila,🚨 ¡La realidad sin filtros! 🚨 Un ciudadano me pregunta: ¿Quién está detrás de la minga?,5399,0,40,334000,0.0,0.12
2025-04-28,Vicky Dávila,"Los jóvenes no son solo el futuro, son el presente. #VickyDavila #Colombia #JuntosSomosMillones",1231,123,6,334000,9.99,0.39
2025-04-28,Vicky Dávila,"Colombia necesita ser manejada como una empresa eficiente, con resultados y buenas prácticas",2842,331,12,334000,11.65,1.03
2025-04-27,Vicky Dávila,Tenemos un sistema asqueroso y yo no vengo a prometer lo imposible. #VickyDavila #Colombia,1522,175,5,334000,11.5,0.54
2025-04-27,Vicky Dávila,"Colombia necesita ser manejada como una empresa eficiente, con resultados, Migrar no es un delito.",2929,305,23,334000,10.41,0.98
2025-04-25,Vicky Dávila,&quot;Aquí el único HP es Petro&quot;. #ElUnicoHpEsPetro #Colombia #VickyDavila,24794,687,151,334000,2.77,2.51
2025-04-24,Vicky Dávila,Entrevista en el puente internacional Simón Bolívar,1220,117,42,334000,9.59,0.48
2025-04-24,Vicky Dávila,"Desde aquí, al borde de Venezuela, entendemos mejor que nadie lo que significa perder la democracia",19648,1239,79,334000,6.31,3.95
2025-04-18,Vicky Dávila,"LA FAMILIA: es el principio de todo, el amor, el puerto seguro. Es todo ♥️ #colombia #vickydávila",6451,0,32,334000,0.0,0.1
2025-04-16,Vicky Dávila,"El ciudadano ESTÁ HARTO de que lo engañen, le mientan, le prometan y no cumplan",2710,163,115,334000,6.01,0.83
2025-04-14,Vicky Dávila,Los beneficios de Emilio Tapia con la justicia. #vickydávila #colombia,6221,0,72,334000,0.0,0.22
2025-04-14,Vicky Dávila,Santiago me sorprendió y se robó mi corazón.  #colombia #vickydávila,3706,454,10,334000,12.25,1.39
2025-04-12,Vicky Dávila,"Mi entrevista con KyenyKe: &#39;Vicky Dávila, del periodismo a la política&#39;",2718,152,79,334000,5.59,0.69
2025-04-11,Vicky Dávila,"Gracias, Medellín. Los quiero mucho.  #colombia #vickydávila",1393,150,5,334000,10.77,0.46
2025-04-11,Vicky Dávila,Desde la obra: Voces que construyen el país.  #colombia #vickydávila,1416,215,10,334000,15.18,0.67
2025-04-10,Vicky Dávila,La casa de los famosos de los POLíTICOS,644,50,10,334000,7.76,0.18
2025-04-09,Vicky Dávila,Yo me sentaría con estos tres influencers a hablar. #VickyDávila #ColombiaConVicky #Colombia,1908,253,2,334000,13.26,0.76
2025-04-09,Vicky Dávila,Chía me recibió con los brazos abiertos. #vickydávila #colombia #colombiaconvicky,1612,0,5,334000,0.0,0.01
2025-04-08,Vicky Dávila,En mi infancia pasé mis Navidades con cartas del expresidente Belisario Betancur.  #vickydávila,3179,368,11,334000,11.58,1.13
2025-04-08,Vicky Dávila,Yo estoy acá para luchar por Colombia.  #colombia #vickydávila #vickydávila,3989,465,59,334000,11.66,1.57
2025-04-07,Vicky Dávila,Llegó el momento de que también se valoren las capacidades de las mujeres.  #vickydávila #colombia,4545,516,32,334000,11.35,1.64
2025-04-06,Vicky Dávila,"Quiero un presidente que no se deje llevar por el poder, como pasa con el actual Gobierno. #Colombia",4620,513,41,334000,11.1,1.66
2025-04-05,Vicky Dávila,"Antioqueños, los quiero mucho, los admiro por su empuje y su berraquera. #VickyDávila #Colombia",4478,683,31,334000,15.25,2.14
2025-04-05,Vicky Dávila,"Gracias a los paisas por sus palabras, me llegan al alma. #VickyDávila #ColombiaConVicky #Colombia",3085,335,20,334000,10.86,1.06
2025-04-05,Vicky Dávila,Mi mejor virtud es no tener experiencia en política. #VickyDávila #ColombiaConVicky #Colombia,1013,134,8,334000,13.23,0.43
2025-04-05,Vicky Dávila,Visitamos la fábrica de Colchones Comodísimos. #VickyDávila #ColombiaConVicky #Colombia,1827,230,26,334000,12.59,0.77
2025-04-04,Vicky Dávila,Recorrimos ‘El Hueco’ en Medellín. Gracias por el cariño. #vickydávila #colombia #colombiaconvicky,3865,0,13,334000,0.0,0.04
2025-04-04,Vicky Dávila,¿Es tan malo el metro de Medellín como muchos dicen? #VickyDávila #ColombiaConVicky #Colombia,3577,294,9,334000,8.22,0.91
2025-04-04,Vicky Dávila,Esta es la realidad que se vive en las manifestaciones de los indígenas. #vickydávila #colombia,1321,0,5,334000,0.0,0.01
2025-04-03,Vicky Dávila,El caos que viven los colombianos a causa de la crisis en la salud,726,72,30,334000,9.92,0.31
2025-04-03,Vicky Dávila,"El orgullo de una madre por su hijo, becado en la universidad de Manizales.  #vickydávila #colombia",1448,165,10,334000,11.4,0.52
2025-04-03,Vicky Dávila,3 de abril de 2025,1472,158,10,334000,10.73,0.5
2025-04-03,Vicky Dávila,Acompañé a Martha en su renacer. El día que venció el cáncer,603,50,8,334000,8.29,0.17
2025-04-03,Vicky Dávila,"“Vicky Dávila, cero MIEDO. Petro nada”, la sabiduría popular. DIOS LES PAGUE Bucaramanga♥️♥️♥️",8954,351,50,334000,3.92,1.2
2025-04-02,Vicky Dávila,"GRACIAS, BUCARAMANGA | Me encantó escuchar a la comunidad.#VickyDávila #ColombiaConVicky #Colombia",1303,145,9,334000,11.13,0.46
2025-04-02,Vicky Dávila,EL DOLOR DE LOS BUMANGUESES: &quot;53 años buscando el sustento y no tenemos derechos&quot;,1439,75,37,334000,5.21,0.34
2025-04-02,Vicky Dávila,Visitamos a los lustradores de Bucaramanga. Juntos somos millones. #VickyDávila #ColombiaConVicky,2175,233,17,334000,10.71,0.75
2025-04-02,Vicky Dávila,Nos encontramos con una joven que nos contó sobre sus sueños. #VickyDávila #ColombiaConVicky,2324,273,14,334000,11.75,0.86
2025-04-02,Vicky Dávila,La Hora del Periodismo de la Universidad Autónoma de Occidente,2219,75,21,334000,3.38,0.29
2025-04-01,Vicky Dávila,Las preguntas con El País de Cali,1114,75,31,334000,6.73,0.32
2025-04-01,Vicky Dávila,"Pensamos en la gente de a pie. Más educación, vivienda y salud. #VickyDávila #ColombiaConVicky",1287,185,11,334000,14.37,0.59
2025-03-31,Vicky Dávila,No se le puede METER IDEOLOGÍA al sistema de la salud,715,64,20,334000,8.95,0.25
2025-03-30,Vicky Dávila,Los esfuerzos de una madre cabeza de familia. #ColombiaConVicky #Colombia #VickyDávila,2484,355,18,334000,14.29,1.12
2025-03-30,Vicky Dávila,La educación de los colombianos es un pilar fundamental. #Colombia #VickyDávila #ColombiaConVicky,1815,355,21,334000,19.56,1.13
2025-03-28,Vicky Dávila,Hay que liberar a los ciudadanos secuestrados en el Cauca. #ColombiaConVicky #Colombia #VickyDávila,7247,780,41,334000,10.76,2.46
2025-03-28,Vicky Dávila,Estas son las siete cosas que usted no sabía sobre Vicky Dávila. #VickyDávila #Colombia,14600,1020,40,334000,6.99,3.17
2025-03-27,Vicky Dávila,Los obreros de Colombia: una lucha contra la pobreza y la inseguridad. #Colombia #VickyDávila,17209,359,5,334000,2.09,1.09
2025-03-26,Vicky Dávila,Hay que tratar a los bandidos CON MANO DURA,8130,266,44,334000,3.27,0.93
2025-03-26,Vicky Dávila,La salud en Colombia se desangra. #Colombia #VickyDávila,45061,1168,52,334000,2.59,3.65
2025-03-26,Vicky Dávila,"Estas son mis ventajas, las que hacen que me motive a luchar por los colombianos. #Colombia",82514,3832,62,334000,4.64,11.66
2025-03-24,Vicky Dávila,"Yo vengo de una familia sencilla, como la mayoría de colombianos #VickyDávila #Colombia",89632,3527,111,334000,3.93,10.89
2025-03-24,Vicky Dávila,Estuve CON MI DOBLE en Besame Radio,1268,168,13,334000,13.25,0.54
2025-03-24,Vicky Dávila,Mi ENTREVISTA en Tropicana,2061,112,50,334000,5.43,0.49
2025-03-23,Vicky Dávila,Las mujeres somos unas berracas y defendemos lo que queremos.,10618,442,13,334000,4.16,1.36
2025-03-23,Vicky Dávila,Colombia merece liderazgo con determinación y sentido común 4. #vickydávila,1196,200,4,334000,16.72,0.61
2025-03-23,Vicky Dávila,Tengo la valentía para combatir la corrupción,1687,277,27,334000,16.42,0.91
2025-03-23,Vicky Dávila,Métanlo a la cárcel con los demás. #VickyDávila #Colombia,1481,337,13,334000,22.75,1.05
2025-03-23,Vicky Dávila,Vicky Dávila hizo EL RECORRIDO DE LA MUERTE en Bogotá. #Colombia #VickyDávila,1597,216,32,334000,13.53,0.74
2025-03-22,Vicky Dávila,PREGUNTAS RÁPIDAS con Tropicana,6092,481,25,334000,7.9,1.51
2025-03-22,Vicky Dávila,Fue el golpe más fuerte de mi vida #Colombia #VickyDávila,4065,474,7,334000,11.66,1.44
2025-03-21,Vicky Dávila,DESASTRE en la entrega de medicamentos para los colombianos,8504,219,85,334000,2.58,0.91
2025-03-21,Vicky Dávila,"No necesitamos MinDeporte, necesitamos que EL DINERO LLEGUE A LOS DEPORTISTAS",2406,537,32,334000,22.32,1.7
2025-03-19,Vicky Dávila,¿Cuánto saben realmente los manifestantes a favor de Petro sobre la reforma?,6172,508,126,334000,8.23,1.9
2025-03-18,Vicky Dávila,Mi Entrevista en La Cariñosa - Cartagena con Rafael Guerra,673,59,7,334000,8.77,0.2
2025-03-18,Vicky Dávila,La marcha de este martes es una farsa,4225,641,100,334000,15.17,2.22
2025-03-13,Vicky Dávila,"Chocó en crisis: Corrupción, abandono y el futuro de la región | Entrevista con Vicky Dávila",880,50,27,334000,5.68,0.23
2025-03-13,Vicky Dávila,¡Petro amenaza la democracia!,1167,184,45,334000,15.77,0.69
2025-03-12,Vicky Dávila,¡PETRO ESTÁ EN CAMPAÑA! | Vicky Davila,1704,107,50,334000,6.28,0.47
